Duration,Ticket_Type,Refund_Policy,Description,LowPrice,HighPrice,Currency,Organizer,EventStatus,StartTime,EndTime,Title,Subtitle,url,City
NA,Sold out,Refunds up to 30 days before event,"Do you feel uneasy, when it comes to disciplining and terminating bad employees? Your head says: ""This bad employee should be terminated"", but you just can't bring yourself to start the disciplinary action? Problems like this will not solve themselves! The more you try to avoid confronting this kind of problems, the more this kind of problems grow and they grow exponentially! The more you try to run away from this kind of problems, the more they chase you!!! ""Short term pain but long term pleasure"", or, ""short term pleasure but long term pain"", which one do you want? You will gain: Reality based insights and wisdom, that will solve your real world business problems; You will lose: all your bad employees and the stomach ulcer your bad employees gave you! ""It's like I've been cured of cancer! I used to think there is nothing I could do about bad employees - taking this class helped me realize it was those bad employees who put that defeatist idea in my head - for their benefit! I was a victim of their dirty unethical games and I was not even aware of the fact that I was being played!!! You need to take this class and get rid of your cancer cells!"" ""I used to live in fear of my short term pain, and did not want to deal with my bad employees. I learned from this class: If I don't go thru the short term pain, I will be suffering the long term pain!  And my bad employees can see how I am in fear of the short term pain! I feel so liberated with my new thinking - my old thinking has been a shackle on my mind!"" ""After taking this class, I added up the total cost of harm my one bad employee was costing us. I almost had a heart attack! You need to take this class and stop the bleeding!"" 1: Delegation Skills for Busy Leaders - Why & How 2: How To Motivate & Inspire Your Employees? Young Employees? 3: How to Overcome Employee's Resistance To Change? 4: How to Create Genuine and Sincere Employee Loyalty? 5: How to Manage the 4 Different Types of Younger Employees? 6: How to Successfully Coach Your Employees? 7: Is being friends with your employees a good idea? or a bad idea? 8: How To Get Your Best Employees To Stay For As Long As Possible? 9: How To Avoid Costly Hiring Mistakes? 10: How to Overcome Your Anxiety with Discipline and Termination? 11: Seven Secrets for Your Leadership Success that They Won't Teach You! Thousands of business leaders, from hundreds of organizations and associations, in dozens of industries, have attended his Leadership Seminars, Workshops, Keynote Sessions & 1-on-1 Coaching sessions. His leadership seminar students love his unique teaching content, as well as his unique teaching method. He is the best, at: ● Discovering what is in people's blindspot that is holding them back, causing internal conflicts deep down inside; ● Effectively teaching his students new ways of understanding their situations, therefore helping them to resolve the conflicts in their thinking, so they can become more productive - instantly! +++ +++ +++ +++ +++ +++ +++ +++ +++ +++ +++ +++ +++ +++ +++ +++ +++ +++ +++ +++ +++ +++ +++ +++ +++ +++ +++ +++ +++ +++ +++ +++ +++ +++ +++ +++ +++ +++ +++ +++ +++ +++ +++ +++ +++ Coach Michael Lin came out of the tech industry, and uses his superb analytical skills to dissect business challenges. He has deep insights into human nature, which he uses to help people to solve their business challenges. His analysis and solutions are all based on Emotional Intelligence, not on how we wish humans ought to be, but based on what humans actually are. Managers & Leaders from over 500 organizations across many industries have attended seminars and workshops taught by Coach Michael Lin. Example industries are: - Airports - Automobile Manufacturers - Aviation Companies - Banks & Credit Unions - Casinos - Charities - Churches - Courts (State and County) - Fire, Police & Sheriff Depts - Food Companies - Governments - Hospitals - Hotel Chains - Insurance Companies - Railroad Companies - School Districts - Technology Companies - Universities - Etc Etc. 1: What makes other people tick? Employees who report to us? Our peer managers & leaders? Outside customers? Outside vendors? Shareholders? Upper management? 2: How to identify the right incentives - for other people? Why we should not confuse “the right incentive for ourselves"" with ""the right incentive for others”? How to utilize our insights into short term vs long term pain & pleasure to influence, persuade and help others, to create Win/Win outcomes for everyone? 3: How to advance our own careers, by going out of our way to: help others?! solve other people's problems?! Why we need to understand the big picture of the corporation (not just ""my department"") and solve problems for the entire corporation? 4: ""Software Upgrade"" in our heads, from employee thinking (my hours for my salary), into business thinking: what do customers need and want? how to provide goods/services for customers? What hardware & human capabilities do we have? how to inspire employees to want to give their best - using non monetary incentives? How to create win/win for everyone? customers, shareholders, employees, and managers/leaders? 5: Why Confidence Building by practicing Fear Busting is the key to Self Development? How we can constantly expand our comfort zone, by doing things we know we should do, but don't do - due to fear? +++ +++ +++ +++ +++ +++ +++ +++ +++ +++ +++ +++ +++ +++ +++ Here is an Interview/Article by Coach Michael Lin on ""Moving From Command & Control to Coaching & Collaboration: How Leaders and Managers Can Become Better Coaches - the Why, the What, and the How"": https://medium.com/authority-magazine/moving-from-command-control-to-coaching-collaboration-michael-lin-on-how-leaders-and-managers-64fdf22eaa71 +++ +++ +++ +++ +++ +++ +++ +++ +++ +++ +++ +++ +++ +++ +++ Here is a list of two dozen people telling us what they thought of the teaching, after they've attended the seminar or workshop by Coach Michael Lin: (These people range from brand new managers to highly experienced leaders, from various private sectors to the government...) https://youtu.be/_jPxflr1LV8 +++ +++ +++ +++ +++ +++ +++ +++ +++ +++ +++ +++ +++ +++ +++ Here is a short sample of Coach Michael Lin in action, helping managers to get over their fears and grow into Real Leaders, so they can do what they are afraid of doing but need to be doing: https://youtu.be/Wc4GylRBQ6U +++ +++ +++ +++ +++ +++ +++ +++ +++ +++ +++ +++ +++ +++ +++ Here are over a dozen media interviews, in which Coach Michael Lin answers tough questions from journalists on leadership: https://www.linkedin.com/in/coachmichaellin/recent-activity/videos/ +++ +++ +++ +++ +++ +++ +++ +++ +++ +++ +++ +++ +++ +++ +++ +++ +++ +++ +++ +++ +++ +++ +++ +++ +++ +++ +++ +++ +++ +++ We have all attended those waste of time seminars that are: Why bring another one of those waste of time seminars to your company? And force employees to endure thru them? Be a real hero, bring a seminar that your employees will: And when leaders improve? everyone in the company gets to enjoy the benefit: from team members to shareholders! And all of them will be thanking you for organizing training that's useful!",33.84,33.84,USD,Coach Michael Lin,https://schema.org/EventScheduled,2024-03-11T14:00:00Z,2024-03-11T14:30:00Z,Gibraltar Leadership: Overcome Anxiety with Discipline & Termination!,"You should attend if you are a manager or a business owner, managing a team of employees, or managing a team of managers.",https://www.eventbrite.com/e/gibraltar-leadership-overcome-anxiety-with-discipline-termination-tickets-610807199777,marbella
NA,Sold out,Refunds up to 7 days before event,"Synthesis of the human Mind “Phase deep into the Night to break high into the Light”. “The MIND is a product of its KNOWING, not its THOUGHTS nor its THINKING, for they are easy to be influenced by the external world, but the Mind which is internal, is NOT them”. Our internal world drives our external world. Our ability to use our mind determines how well we can control our external realities. What you may not know is that our Minds have an identity. Creating an Identity of mind allows us to direct our external world intentionally. The language we use to run our lives is one dimensional, which creates needless limitations. Our minds work best in a multidimensional language. Learning how to access your minds resources correctly will enable you to create a life beyond who we desire to be. Our vocabulary, are words we use internally to motivate change, but instead of encouraging us, the imperfections in our speech and articulation restrict access to our minds. There is no synchronicity between the one-dimensional language in our speech and the 4 th dimension of the mind. If you’re not using the correct language of the mind, the mind disengages where we become confused. We don’t have the language to describe the life that we want in a way that the mind accepts, understands, and can utilise. Mind ReMapping is a language illuminating an internal identity, so that we no longer need to be afraid of the dark, neither do we need to be afraid of our minds and what the future holds for us. Meta Tech Organica – Excited about Dimensions of LIVING D0 – Orientation – Who you are & who you are NOT. D1 – Point of Focus – What Where When Why & How to SEE. D2 – Objectification – Finding Imagination. D3 – Understanding – 4 Dimensions of Quadrilateral Thinking D4 – TIME – Mind ReMapping.(Cognitive Positioning System) Thank you for your patience. Mind ReMapping N.B. ALL EVENTS ARE ONLINE",14.99,44.99,GBP,Gavin Gooden,https://schema.org/EventScheduled,2024-03-11T18:00:00Z,2024-03-11T19:30:00Z,Mind ReMapping - LOST WITHOUT AN  IDENTITY  - ONLINE - Malaga.,"The MIND ReMapping  Philosophy: ""Be so Creatively removed from reality, that the Mind has no choice, but to come out of hiding….""",https://www.eventbrite.co.uk/e/mind-remapping-lost-without-an-identity-online-malaga-tickets-637996935007,marbella
NA,Sold out,Contacta con el organizador para solicitar un reembolso.,"🚨 ¡Información importante! Lea hasta el final 🚨 * English below* Descubre cómo la Sanación Pránica puede ser la clave para tu bienestar integral con sesiones personalizadas, diseñadas para abordar tus necesidades específicas: 1️⃣ Cura Física: Las técnicas de Sanación Pránica están diseñadas para acelerar el proceso de autorecuperación del cuerpo, aliviando dolencias físicas y promoviendo la salud. 💆‍♂️2️⃣ Equilibrio Emocional: Trabajamos en el equilibrio de los centros de energía (chakras) para fortalecer la estabilidad emocional, proporcionando alivio a tensiones emocionales. 🌈3️⃣ Bienestar Mental: La Sanación Pránica incluye prácticas que calman la mente, reducen el estrés y mejoran la claridad mental. 🧘‍♂️4️⃣ Curación Holística: Abordamos no solo los síntomas físicos, sino también las causas subyacentes, ofreciendo una perspectiva holística hacia la salud. 🤲5️⃣ Herramientas de Autosanación: Aprende técnicas que te capacitarán para contribuir a tu propio proceso de curación. 💪6️⃣ Complemento Terapéutico: La Sanación Pránica actúa en armonía con los tratamientos convencionales, ofreciendo un enfoque integral para tu bienestar. 💖 Descubre cómo la Sanación Pránica puede mejorar tu calidad de vida. 🌿 Soy Clarice Deluchi, Terapeuta Pránica con más de 12 años de experiencia. Esta técnica sin toque trabaja en tu cuerpo energético, influyendo positivamente en chakras, aura y órganos. Elimina las energías negativas, brindando paz interior, reduciendo el estrés y mucho más. Especializada en Terapia Pránica Avanzada, Psicoterapia Pránica, Terapia Pránica con Cristales y más, ofrezco atención personalizada para aliviar dolencias físicas y emocionales. Mi experiencia internacional en Brasil, Israel, Alemania y España me permite brindar un enfoque completo, respetando la armonía con la medicina tradicional. 🔹 Es importante destacar que la Sanación Pránica Pránica (MCKS) es una técnica sin contacto y actúa como un complemento a la medicina tradicional, trabajando en armonía con ella para lograr los mejores resultados en la salud y el bienestar de las personas. 🔹 Contáctame en cdeluchi@gmail.com Ubicación: Málaga Tarifas y reservas: Gestor de agendamento🔴 La sesión de Sanación Pránica es totalmente gratuita, pero la reserva de la sesión tiene un coste que se cargará directamente en el sitio web. 🔴 ¡hablo Español, inglés, portugués y entiendo alemán! ¡Te deseo un día maravilloso! 🌻✨🌷Clarice Deluchi ---- ---- ---- ---  🚨 Important information! Read to the end 🚨 Discover how Pranic Healing can be the key to your holistic wellness with customized sessions designed to address your specific needs: 1️⃣ Physical Healing: Pranic Healing techniques are designed to accelerate the body's self-healing process, alleviating physical ailments and promoting health. 💆‍♂️ 2️⃣ Emotional Balance: We work on balancing the energy centers (chakras) to strengthen emotional stability, providing relief from emotional tensions. 🌈 3️⃣ Mental Wellness: Pranic Healing includes practices that calm the mind, reduce stress and improve mental clarity. 🧘‍♂️ 4️⃣ Holistic Healing: We address not only physical symptoms, but also the underlying causes, offering a holistic perspective towards health. 🤲 5️⃣ Self-Healing Tools: Learn techniques that will empower you to contribute to your own healing process. 💪 6️⃣ Therapeutic Complement: Pranic Healing acts in harmony with conventional treatments, offering an integral approach to your well-being. 💖 Discover how Pranic Healing can improve your quality of life. 🌿 I am Clarice Deluchi, Pranic Therapist with more than 12 years of experience. This touchless technique works on your energetic body, positively influencing chakras, aura and organs. It eliminates negative energies, bringing inner peace, reducing stress and much more. Specializing in Advanced Pranic Therapy, Pranic Psychotherapy, Pranic Crystal Therapy and more, I offer personalized attention to alleviate physical and emotional ailments. My international experience in Brazil, Israel, Germany and Spain allows me to provide a complete approach, respecting harmony with traditional medicine. 🔹 It is important to note that Pranic Pranic Healing (MCKS) is a non-contact technique and acts as a complement to traditional medicine, working in harmony with it to achieve the best results in people's health and well-being. 🔹 Contact me at cdeluchi@gmail.com Location: Málaga Fees and reservations: Schedule manager. 🔴 The Pranic Healing session is totally free, but the booking of the session has a cost that will be charged directly on the website. 🔴 I speak Spanish, English, Portuguese and I understand German! I wish you a wonderful day! 🌻✨🌷 Clarice Deluchi https://goldenpranaandalucia.es/",55.67,55.67,EUR,Clarice Deluchi,https://schema.org/EventScheduled,2024-03-11T17:00:00Z,2024-03-11T18:00:00Z,Sanación Pránica,"¿Buscas alivio para tus dolencias físicas, emocionales y mentales?
¿Lidiando con la ansiedad? Depression? Estress?",https://www.eventbrite.es/e/entradas-sanacion-pranica-735417372157,marbella
NA,Sold out,Contact the organizer to request a refund.,"‘Dinner and a movie’ is so 2021! Especially when the movie is now played out in the real-world. Let us explain! The route you’re going to follow in the city is sprinkled with charming and picturesque places, fun clues and challenges, and romantic stories of past and present. The experience will play out like you’re the main characters of a movie, only that you’re experiencing everything in first person! Fun dialogue, intrigue, and unexpected interactions are guaranteed. Play a city game that will take you back to a Málaga of the XIX century, at a time when society was highly hierarchic and relationships between the locals and the gipsy communities were completely stranded. Wander on the sunny streets as you search for your lost lover: a ""gitana"" princess who stole your heart away. This story of forbidden love will take you through the most emblematic and hidden corners of the city, where you will find out all about the many cultures that flourished here. HOW IT WORKS❓ 1. Book your tickets 🎫 2. Download the Questo app - it's free 📲 3. Head to the starting point📍 WHAT YOU’LL DO The game is an interactive activity where you are guided by a mobile app through the city. With it, you follow directions and solve very fun puzzles, riddles, and cryptic codes. During the game, you will also visit popular and hidden places in the city while learning fun (and we mean it) stories about them. This is a storytelling experience just as much. The people doing these city exploration games gave them an average rating of 4.7/5 around the world. Join the playground too! ------------------ More about Questo 🚶‍♀️ Questo is an urban entertainment platform offering thematic real-world exploration games. It is currently available in over 130 cities 🌎 and has entertained hundreds of thousands of players already. As of today, the app offers more than 300 different experiences created by a growing network of local content creators and event organizers.",9.99,39.99,EUR,Questo - City Exploration Games,https://schema.org/EventScheduled,2024-03-11T11:00:00Z,2024-03-11T12:30:00Z,Highlights of Malaga - Outdoor Escape Game,"If you’re looking for a new and exciting way of spending time with your one and only, family or friends, this is your Eureka moment!",https://www.eventbrite.com/e/highlights-of-malaga-outdoor-escape-game-tickets-478212024037,marbella
NA,Sold out,Contact the organiser to request a refund.,"Embark on your Málaga treasure hunt adventure now! Seize the opportunity to discover the city in a completely new light, unveil hidden gems, and create lasting memories. Secure your spot today and immerse yourself in the thrill of Málaga's exclusive sightseeing treasure hunt! Explore the beauty of Málaga like never before with our Private Sightseeing Treasure Hunt – an ideal experience for couples, families, and groups seeking an unforgettable memory of Málaga. This activity provides a distinctive way to explore and fall in love with the city, going beyond the limitations of traditional bus or bicycle tours. Your Málaga adventure kicks off with a warm welcome and briefing by our friendly Treasure Hunt Master. They'll equip you with a treasure hunting bag containing a modern compass, a treasure book, and an array of engaging gadgets. Following a brief introduction, the adventure is in your hands. During this 2-hour exploration, you'll delve into Málaga's historic center, navigating with the modern compass and treasure book. Your journey will lead you to iconic destinations like the famous food market, the lively Plaza de la Merced, the Carmen Thyssen Museum, the majestic cathedral, the ancient Roman theatre, Picasso’s birthplace, the Alcazaba Castle, the exotic gardens, and numerous hidden gems off the beaten tourist path. Along the way, you'll absorb the genuine ambiance of Málaga's charming city center at your own pace. At each station, you'll unravel riddles and partake in playful tasks to collect essential clues, all guiding you towards the thrilling climax: discovering the treasure chest. These activities won't consume much time, ensuring you have ample opportunity to explore each location highlighted in your treasure book. Additionally, you won’t need your smartphone during this activity, allowing you to disconnect and fully enjoy the experience. As the activity concludes at the final station, you'll encounter the secret treasure chest, containing a lovely and highly personal Málaga souvenir. Wrap up the tour at a central location, perfectly situated for further exploration or returning to your accommodations, ensuring your day in Málaga concludes on a high note. The puzzles and tasks of the treasure hunt are tailored around the details of Málaga, designed to be solvable by everyone. Our goal is for you to explore Málaga in a delightful and playful manner. Here are some added benefits of the Sightseeing Treasure Hunt in Málaga for your customers: **Customized Experience**: Tailored to suit your group's preferences and pace, ensuring a personalized and enjoyable outing. **Local Insights**: Gain insider knowledge and local recommendations from your Treasure Hunt Master. **Family-Friendly**: Suitable for all ages, the activity is a fantastic way to explore Málaga together. **Novel Experience**: Beyond typical sightseeing, this treasure hunt adds an element of excitement and adventure to your Málaga visit.",28,28,EUR,Malaga City Adventure,https://schema.org/EventScheduled,2024-03-11T09:00:00Z,2024-03-11T11:30:00Z,Sightseeing Treasure Hunt Malaga,Can you find the secret Treasure of Málaga? Discover the historical Old Town of Malaga on a fun and interactive Sightseeing Treasure Hunt,https://www.eventbrite.com/e/sightseeing-treasure-hunt-malaga-tickets-413963896157,marbella
NA,Sold out,Contact the organizer to request a refund.,"A different way of Sightseeing Explore Málaga on our memorable Treasure Hunt Tour! Are you looking for an exciting and unforgettable activity in Malaga as a family, couple, friends or group? Discover Malaga at your own pace and admire the most famous sights, attractions, cultural highlights and hidden gems in the historical city centre of Malaga on a Pirate Treasure Hunt Tour. The route you’re going to follow in the city is sprinkled with unique places, fun clues and challenges, and incredible stories. The experience will play out like you’re the main characters of a movie, only that you’re experiencing everything in first person! Fun dialogue, intrigue, and unexpected interactions are guaranteed. HOW IT WORKS❓ 1. Book your tickets 🎫 2. Download the Questo app - it's free 📲 3. Head to the starting point📍 WHAT YOU’LL DO The game is an interactive activity where you are guided by a mobile app through the city. With it, you follow directions and solve very fun puzzles, riddles, and cryptic codes. During the game, you will also visit popular and hidden places in the city while learning fun (and we mean it) stories about them. This is a storytelling experience just as much. The people doing these city exploration games gave them an average rating of 4.7/5 around the world. Join the playground too! ------------------ More about Questo 🚶‍♀️ Questo is an urban entertainment platform offering thematic real-world exploration games. It is currently available in over 150 cities 🌎 and has entertained hundreds of thousands of players already. As of today, the app offers more than 400 different experiences created by a growing network of local content creators and event organizers.",9.99,39.99,EUR,Questo - City Exploration Games,https://schema.org/EventScheduled,2024-03-11T11:00:00Z,2024-03-11T12:30:00Z,Malaga Outdoor Escape Game: Sightseeing Treasure Hunt,"Follow clues, solve puzzles, discover new places and learn incredible stories of the city's past and present during this city adventure.",https://www.eventbrite.com/e/malaga-outdoor-escape-game-sightseeing-treasure-hunt-tickets-539575403557,marbella
