Duration,Ticket_Type,Refund_Policy,Description,LowPrice,HighPrice,Currency,Organizer,EventStatus,StartTime,EndTime,Title,Subtitle,url,City
NA,Sold out,Refunds up to 7 days before event,"Synthesis of the human Mind Our internal world drives our external world. Our ability to use our mind determines how well we can control our external realities. What you may not know is that our Minds have an identity. Creating an Identity of mind allows us to direct our external world intentionally. The language we use to run our lives is one dimensional, which creates needless limitations. Our minds work best in a multidimensional language. Learning how to access your minds resources correctly will enable you to create a life beyond who we desire to be. Our vocabulary, are words we use internally to motivate change, but instead of encouraging us, the imperfections in our speech and articulation restrict access to our minds. There is no synchronicity between the one-dimensional language in our speech and the 4 th dimension of the mind. If you’re not using the correct language of the mind, the mind disengages where we become confused. We don’t have the language to describe the life that we want in a way that the mind accepts, understands, and can utilise. Mind ReMapping is a language illuminating an internal identity, so that we no longer need to be afraid of the dark, neither do we need to be afraid of our minds and what the future holds for us. Meta Tech Organica – Excited about Dimensions of LIVING D0 – Orientation – Who you are & who you are NOT. D1 – Point of Focus – What Where When Why & How to SEE. D2 – Objectification – Finding Imagination. D3 – Understanding – 4 Dimensions of Quadrilateral Thinking D4 – TIME – Mind ReMapping.(Cognitive Positioning System) Thank you for your patience. Mind ReMapping N.B. ALL EVENTS ARE ONLINE",14.99,44.99,GBP,Gavin Gooden,https://schema.org/EventScheduled,2024-03-11T19:00:00Z,2024-03-11T20:30:00Z,Mind ReMapping - MINDS LOST WITHOUT IDENTITY  - Marbella - ONLINE,"The MIND ReMapping  Philosophy: ""Be so Creatively removed from reality, that the Mind has no choice, but to come out of hiding….""",https://www.eventbrite.co.uk/e/mind-remapping-minds-lost-without-identity-marbella-online-tickets-645209327467,marbella
NA,Sold out,Contact the organizer to request a refund.,"Enjoy a funny exploration game, treasure hunt type, chasing clues, and discovering corners of Marbella with your children. All united by a fantasy tale and a little bit of magic 😉For children from 5 to 13 years old, with the help and supervision of an adult Once downloaded you can play as many times as you want, pause it, and resume it, forever 🤩 The route you’re going to follow in the city is sprinkled with unique places, fun clues and challenges, and incredible stories. The experience will play out like you’re the main characters of a movie, only that you’re experiencing everything in first person! Fun dialogue, intrigue, and unexpected interactions are guaranteed. HOW IT WORKS❓ 1. Book your tickets 🎫 2. Download the Questo app - it's free 📲 3. Head to the starting point📍 WHAT YOU’LL DO The game is an interactive activity where you are guided by a mobile app through the city. With it, you follow directions and solve very fun puzzles, riddles, and cryptic codes. During the game, you will also visit popular and hidden places in the city while learning fun (and we mean it) stories about them. This is a storytelling experience just as much. The people doing these city exploration games gave them an average rating of 4.7/5 around the world. Join the playground too! ------------------ More about Questo 🚶‍♀️ Questo is an urban entertainment platform offering thematic real-world exploration games. It is currently available in over 150 cities 🌎 and has entertained hundreds of thousands of players already. As of today, the app offers more than 400 different experiences created by a growing network of local content creators and event organizers.",9.99,39.99,EUR,Questo - City Exploration Games,https://schema.org/EventScheduled,2024-03-11T11:00:00Z,2024-03-11T12:30:00Z,Marbella Outdoor Escape Game: The magic coins,"Embark on a thrilling adventure as you follow clues, solve intricate puzzles, and uncover hidden gems in the city.",https://www.eventbrite.com/e/marbella-outdoor-escape-game-the-magic-coins-tickets-706494352627,marbella
NA,Sold out,Contact the organizer to request a refund.,"Enjoy a fun exploration game, treasure hunt type, chasing clues, and discovering corners of Estepona with your children. All united by a fantasy tale and a little bit of magic 😉 For children from 5 to 11 years old, with the help and supervision of an adult. Once downloaded you can play as many times as you want, pause it, and resume it, forever 🤩  The route you’re going to follow in the city is sprinkled with unique places, fun clues and challenges, and incredible stories. The experience will play out like you’re the main characters of a movie, only that you’re experiencing everything in first person! Fun dialogue, intrigue, and unexpected interactions are guaranteed. HOW IT WORKS❓ 1. Book your tickets 🎫 2. Download the Questo app - it's free 📲 3. Head to the starting point📍 WHAT YOU’LL DO  The game is an interactive activity where you are guided by a mobile app through the city. With it, you follow directions and solve very fun puzzles, riddles, and cryptic codes. During the game, you will also visit popular and hidden places in the city while learning fun (and we mean it) stories about them. This is a storytelling experience just as much. The people doing these city exploration games gave them an average rating of 4.7/5 around the world. Join the playground too! ------------------ More about Questo 🚶‍♀️ Questo is an urban entertainment platform offering thematic real-world exploration games. It is currently available in over 150 cities 🌎 and has entertained hundreds of thousands of players already. As of today, the app offers more than 400 different experiences created by a growing network of local content creators and event organizers.",7.99,29.99,EUR,Questo - City Exploration Games,https://schema.org/EventScheduled,2024-03-11T11:00:00Z,2024-03-11T12:30:00Z,Streets of Estepona Outdoor Escape Game: The Magic Blocks,"Embark on a thrilling adventure as you follow clues, solve intricate puzzles, and uncover hidden gems in the city.",https://www.eventbrite.com/e/streets-of-estepona-outdoor-escape-game-the-magic-blocks-tickets-706510370537,marbella
NA,Sold out,Contact the organiser to request a refund.,NA,5.77,5.77,EUR,Janet - Dona Eden certified energy healer and Mindvalley Therapist,https://schema.org/EventScheduled,2024-03-11T07:30:00Z,2024-03-11T08:30:00Z,"Mindful meditation -Dance therapy, Kundaluni, Energy healing, Breathwork","Connect with your spiritual side, become more mindful, learn to love yourself more. Join us for mindful meditation, breathwork and Kundaluni",https://www.eventbrite.com/e/mindful-meditation-dance-therapy-kundaluni-energy-healing-breathwork-tickets-618260372417,marbella
NA,Sold out,No Refunds,"Purchase a ticket to our live events and enjoy a 7-day bonus access. Dive into Healing Sessions, Masterclasses, Breathing Experiences, and Live Breathing Classes immediately. Learn more. The Healing Breathwork is a 75-minute online session of Soul Dimension Breathing, focused on addressing healing needs. With a deep focus on healing breathwork techniques, these sessions offer a powerful tool for healing and transformation at physical and emotional levels. You will learn how to use your breath to release emotional blocks, and accelerate the physical and emotional healing processes, and receive guidance to address your unique healing needs. As your week starts enjoy the opportunity to begin your healing breathwork journey with Soul Dimension Breathing Technique. During the Healing Breathwork session, you will be safely and gently guided to explore, feel and connect to deeper layers of your body, emotions, and consciousness that will allow you to quickly and effectively access a profound connection with your body, mind, heart, and Soul unlocking all levels of self-healing. Sylvie has been guiding spiritual seekers for over 30 years with the self-transformative teachings of yoga, pranayama, healing breathwork, and meditation. ""It is my pleasure and honor to guide you toward self-empowerment, transformation, and awakened consciousness. I will help you connect to your deepest self and inner guide with breathwork from the physical to the soul dimension. Sylvie The Soul Dimension Breathing is a unique technique that combines the ancient knowledge of yoga pranayama, chakras, energy, sound healing, and modern science-backed information about the powerful benefits of breathwork.",22.11,22.11,USD,Soul Dimension,https://schema.org/EventScheduled,2024-03-11T18:00:00Z,2024-03-11T19:15:00Z,Healing Breathwork | Accelerate emotional and physical healing • Malaga,"Release emotional blocks, physical tension, and accelerate physical and emotional healing in our online Healing Breathwork Session.",https://www.eventbrite.com/e/healing-breathwork-accelerate-emotional-and-physical-healing-malaga-tickets-820808589587,marbella
NA,Sold out,Contact the organizer to request a refund.,"Play a city game and go on an interesting walking tour, where you will follow clues and solve puzzles to discover amazing places, curiosities, and stories about Gibraltar. (while following an inner journey that shows what the eyes can’t see). As a player, you will take an engaging exploration of Gibraltar’s town center, while learning intriguing anecdotes, and also some legends. Are you ready to explore? The route you’re going to follow in the city is sprinkled with unique places, fun clues and challenges, and incredible stories. The experience will play out like you’re the main characters of a movie, only that you’re experiencing everything in first person! Fun dialogue, intrigue, and unexpected interactions are guaranteed. HOW IT WORKS❓ 1. Book your tickets 🎫 2. Download the Questo app - it's free 📲 3. Head to the starting point📍 WHAT YOU’LL DO The game is an interactive activity where you are guided by a mobile app through the city. With it, you follow directions and solve very fun puzzles, riddles, and cryptic codes. During the game, you will also visit popular and hidden places in the city while learning fun (and we mean it) stories about them. This is a storytelling experience just as much. The people doing these city exploration games gave them an average rating of 4.7/5 around the world. Join the playground too! ------------------ More about Questo 🚶‍♀️ Questo is an urban entertainment platform offering thematic real-world exploration games. It is currently available in over 150 cities 🌎 and has entertained hundreds of thousands of players already. As of today, the app offers more than 400 different experiences created by a growing network of local content creators and event organizers.",9.99,39.99,EUR,Questo - City Exploration Games,https://schema.org/EventScheduled,2024-03-11T11:00:00Z,2024-03-11T12:30:00Z,Gibraltar Town Center Outdoor Escape Game: A Story Adventure,"Follow clues, solve puzzles, discover new places and learn incredible stories of the city's past and present during this city adventure.",https://www.eventbrite.com/e/gibraltar-town-center-outdoor-escape-game-a-story-adventure-tickets-661583031657,marbella
NA,Sold out,No Refunds,NA,16.96,16.96,GBP,"CyberActivities, Inc.",https://schema.org/EventScheduled,2024-03-11T10:00:00Z,2024-03-11T18:00:00Z,Scavenger Hunt Gibraltar,A family friendly traditional scavenger hunt with a modern twist!,https://www.eventbrite.com/e/scavenger-hunt-gibraltar-tickets-836448348527,marbella
NA,Sold out,Contact the organizer to request a refund.,"Play a city game where Pablo Picasso’s spirit will help you to uncover Málaga’s top places and teach you about its history. You will learn about the city’s Moorish and Roman ruins, famous artists, writers, as well as Picasso, and uncover the most iconic landmarks and hidden treasures. Pay close attention though… You may need to help Picasso. He is trapped! The route you’re going to follow in the city is sprinkled with unique places, fun clues and challenges, and incredible stories. The experience will play out like you’re the main characters of a movie, only that you’re experiencing everything in first person! Fun dialogue, intrigue, and unexpected interactions are guaranteed. HOW IT WORKS❓ 1. Book your tickets 🎫 2. Download the Questo app - it's free 📲 3. Head to the starting point📍 WHAT YOU’LL DO The game is an interactive activity where you are guided by a mobile app through the city. With it, you follow directions and solve very fun puzzles, riddles, and cryptic codes. During the game, you will also visit popular and hidden places in the city while learning fun (and we mean it) stories about them. This is a storytelling experience just as much. The people doing these city exploration games gave them an average rating of 4.7/5 around the world. Join the playground too! ------------------ More about Questo 🚶‍♀️ Questo is an urban entertainment platform offering thematic real-world exploration games. It is currently available in over 150 cities 🌎 and has entertained hundreds of thousands of players already. As of today, the app offers more than 400 different experiences created by a growing network of local content creators and event organizers.",7.99,29.99,EUR,Questo - City Exploration Games,https://schema.org/EventScheduled,2024-03-11T11:00:00Z,2024-03-11T12:30:00Z,Picasso's Malaga: Outdoor Escape Game,"Follow clues, solve puzzles, discover new places and learn incredible stories of the city's past and present during this city adventure.",https://www.eventbrite.com/e/picassos-malaga-outdoor-escape-game-tickets-735159029447,marbella
NA,Sold out,Refunds up to 30 days before event,"And you need to acquire the leadership skills to get your team members to embrace change. Take this class, learn leadership skills that's 100% based in real world insight and wisdom, so you can catapult you and your team to the next level of success! 1: Delegation Skills for Busy Leaders - Why & How 2: How To Motivate & Inspire Your Employees? Young Employees? 3: How to Overcome Employee's Resistance To Change? 4: How to Create Genuine and Sincere Employee Loyalty? 5: How to Manage the 4 Different Types of Younger Employees? 6: How to Successfully Coach Your Employees? 7: Is being friends with your employees a good idea? or a bad idea? 8: How To Get Your Best Employees To Stay For As Long As Possible? 9: How To Avoid Costly Hiring Mistakes? 10: How to Overcome Your Anxiety with Discipline and Termination? 11: Seven Secrets for Your Leadership Success that They Won't Teach You! Thousands of business leaders, from hundreds of organizations and associations, in dozens of industries, have attended his Leadership Seminars, Workshops, Keynote Sessions & 1-on-1 Coaching sessions. His leadership seminar students love his unique teaching content, as well as his unique teaching method. He is the best, at: ● Discovering what is in people's blindspot that is holding them back, causing internal conflicts deep down inside; ● Effectively teaching his students new ways of understanding their situations, therefore helping them to resolve the conflicts in their thinking, so they can become more productive - instantly! +++ +++ +++ +++ +++ +++ +++ +++ +++ +++ +++ +++ +++ +++ +++ +++ +++ +++ +++ +++ +++ +++ +++ +++ +++ +++ +++ +++ +++ +++ +++ +++ +++ +++ +++ +++ +++ +++ +++ +++ +++ +++ +++ +++ +++ Coach Michael Lin came out of the tech industry, and uses his superb analytical skills to dissect business challenges. He has deep insights into human nature, which he uses to help people to solve their business challenges. His analysis and solutions are all based on Emotional Intelligence, not on how we wish humans ought to be, but based on what humans actually are. Managers & Leaders from over 500 organizations across many industries have attended seminars and workshops taught by Coach Michael Lin. Example industries are: - Airports - Automobile Manufacturers - Aviation Companies - Banks & Credit Unions - Casinos - Charities - Churches - Courts (State and County) - Fire, Police & Sheriff Depts - Food Companies - Governments - Hospitals - Hotel Chains - Insurance Companies - Railroad Companies - School Districts - Technology Companies - Universities - Etc Etc. 1: What makes other people tick? Employees who report to us? Our peer managers & leaders? Outside customers? Outside vendors? Shareholders? Upper management? 2: How to identify the right incentives - for other people? Why we should not confuse “the right incentive for ourselves"" with ""the right incentive for others”? How to utilize our insights into short term vs long term pain & pleasure to influence, persuade and help others, to create Win/Win outcomes for everyone? 3: How to advance our own careers, by going out of our way to: help others?! solve other people's problems?! Why we need to understand the big picture of the corporation (not just ""my department"") and solve problems for the entire corporation? 4: ""Software Upgrade"" in our heads, from employee thinking (my hours for my salary), into business thinking: what do customers need and want? how to provide goods/services for customers? What hardware & human capabilities do we have? how to inspire employees to want to give their best - using non monetary incentives? How to create win/win for everyone? customers, shareholders, employees, and managers/leaders? 5: Why Confidence Building by practicing Fear Busting is the key to Self Development? How we can constantly expand our comfort zone, by doing things we know we should do, but don't do - due to fear? +++ +++ +++ +++ +++ +++ +++ +++ +++ +++ +++ +++ +++ +++ +++ Here is an Interview/Article by Coach Michael Lin on ""Moving From Command & Control to Coaching & Collaboration: How Leaders and Managers Can Become Better Coaches - the Why, the What, and the How"": https://medium.com/authority-magazine/moving-from-command-control-to-coaching-collaboration-michael-lin-on-how-leaders-and-managers-64fdf22eaa71 +++ +++ +++ +++ +++ +++ +++ +++ +++ +++ +++ +++ +++ +++ +++ Here is a list of two dozen people telling us what they thought of the teaching, after they've attended the seminar or workshop by Coach Michael Lin: (These people range from brand new managers to highly experienced leaders, from various private sectors to the government...) https://youtu.be/_jPxflr1LV8 +++ +++ +++ +++ +++ +++ +++ +++ +++ +++ +++ +++ +++ +++ +++ Here is a short sample of Coach Michael Lin in action, helping managers to get over their fears and grow into Real Leaders, so they can do what they are afraid of doing but need to be doing: https://youtu.be/Wc4GylRBQ6U +++ +++ +++ +++ +++ +++ +++ +++ +++ +++ +++ +++ +++ +++ +++ Here are over a dozen media interviews, in which Coach Michael Lin answers tough questions from journalists on leadership: https://www.linkedin.com/in/coachmichaellin/recent-activity/videos/ +++ +++ +++ +++ +++ +++ +++ +++ +++ +++ +++ +++ +++ +++ +++ +++ +++ +++ +++ +++ +++ +++ +++ +++ +++ +++ +++ +++ +++ +++ We have all attended those waste of time seminars that are: Why bring another one of those waste of time seminars to your company? And force employees to endure thru them? Be a real hero, bring a seminar that your employees will: And when leaders improve? everyone in the company gets to enjoy the benefit: from team members to shareholders! And all of them will be thanking you for organizing training that's useful!",33.84,33.84,USD,Coach Michael Lin,https://schema.org/EventScheduled,2024-03-11T15:00:00Z,2024-03-11T15:30:00Z,Gibraltar Leadership: How to Overcome Employee's Resistance To Change?,"You should attend if you are a manager or a business owner, managing a team of employees, or managing a team of managers.",https://www.eventbrite.com/e/gibraltar-leadership-how-to-overcome-employees-resistance-to-change-tickets-610807209807,marbella
