Duration,Ticket_Type,Refund_Policy,Description,LowPrice,HighPrice,Currency,Organizer,EventStatus,StartTime,EndTime,Title,Subtitle,url,City
NA,Sold out,NA,"Uno de los barrio mas importantes y populares de Sevilla, incontables son las veces que los propios sevillanos lo atravesamos pero muy pocas apreciamos todo lo que esconde.  Los visitantes se pierden entre tanta mezcla de historia, arquitectura, olores e imágenes quedándose muchos detalles por descubrir.  Esta es la oportunidad para hallarlo. Todo ello aderezado con las anécdotas, curiosidades e historias de los diferentes lugares por los que transcurre el paseo. Ah, tranquilos, no nos enfadamos, ni nos disgusta , si al finalizar la visita os apetece sorprendernos con vuestra voluntad económica aunque sea simbólica, como muestra de que nuestra ruta, ha sido de su agrado. Os esperamos. NOTA:  confirmar OBLIGATORIAMENTE asistencia vía mail: info@tolarte.es o teléfono: 682702191 (llamada o WhatsApp )",0,0,EUR,TOLARTE,https://schema.org/EventScheduled,2024-03-09T16:00:00Z,2024-03-09T17:30:00Z,RUTA GRATUITA: LA VERDADERA JUDERIA,"Ven a descubrir la verdadera Judería, ya que la vendemos y nos la venden como le barrio de Santa Cruz y en realidad eso es solo una parte.",https://www.eventbrite.es/e/entradas-ruta-gratuita-la-verdadera-juderia-80663810629,sevilla
NA,Sold out,Contact the organizer to request a refund.,"Play a city game and go on an interesting walking tour, where you will follow clues and solve puzzles to discover amazing places, curiosities, and stories about Cadiz. You can explore the place by yourself, without a guide! Once downloaded, you have it forever: play as many times as you want, change the language, pause it, and resume it 🤩 Are you ready to explore? The route you’re going to follow in the city is sprinkled with unique places, fun clues and challenges, and incredible stories. The experience will play out like you’re the main characters of a movie, only that you’re experiencing everything in first person! Fun dialogue, intrigue, and unexpected interactions are guaranteed. HOW IT WORKS❓ 1. Book your tickets 🎫 2. Download the Questo app - it's free 📲 3. Head to the starting point📍 WHAT YOU’LL DO The game is an interactive activity where you are guided by a mobile app through the city. With it, you follow directions and solve very fun puzzles, riddles, and cryptic codes. During the game, you will also visit popular and hidden places in the city while learning fun (and we mean it) stories about them. This is a storytelling experience just as much. The people doing these city exploration games gave them an average rating of 4.7/5 around the world. Join the playground too! ------------------ More about Questo 🚶‍♀️ Questo is an urban entertainment platform offering thematic real-world exploration games. It is currently available in over 150 cities 🌎 and has entertained hundreds of thousands of players already. As of today, the app offers more than 400 different experiences created by a growing network of local content creators and event organizers.",9.99,39.99,EUR,Questo - City Exploration Games,https://schema.org/EventScheduled,2024-03-09T17:00:00Z,2024-03-09T18:30:00Z,Discover Cadiz Town Cente Outdoor Escape Game: A Story Adventure,"Follow clues, solve puzzles, discover new places and learn incredible stories of the city's past and present during this city adventure.",https://www.eventbrite.com/e/discover-cadiz-town-cente-outdoor-escape-game-a-story-adventure-tickets-746281547197,sevilla
NA,Sold out,No Refunds,"Awaken your mind and body to a new level and learn how to practice meditation in motion. The purpose of this yoga lineage is to guide you toward cultivating a conscious connection, integration and awakening of the body, mind, heart and spirit. You will learn and practice Patanjali's 8 limbs of yoga: Work primarily with the Amrit posture sequence, gentle vinyasa flows and extended posture holding times. Explore the deepest levels of body, mind and spirit with the integrative practices of clear intention, breath, meditative awareness and conscious integration. Learn to balance your nervous system with the “first half” and “second half” of a posture. To transition from an active state of “doing” a posture, to a relaxed state of “being”. And to feel the effects of a posture. Learn to consciously encounter your ""edge"" of body and mind to release deep tensions and restore the natural flow of the vital life force energy (prana). Good for all levels, from those with some experience to more experienced practitioners. Some experience with yoga and postures is recommended. BIOGRAPHY I have been guiding spiritual seekers for over 30 years with the self-transformative teachings of yoga, meditation, Ayurveda and breathing. It is my pleasure and honor to guide you toward self-empowerment, transformation and awakened consciousness. I will help you connect to your deepest self and inner guide, from the physical to the soul dimension. SOULDIMENSION.ORG Copyright © 2022 • Soul Dimension",16.49,16.49,USD,Soul Dimension,https://schema.org/EventScheduled,2024-03-09T16:00:00Z,2024-03-09T17:30:00Z,Awakening Yoga • Weekly Class • Cordoba,Weekly online class with a spiritual focus to awaken one’s consciousness and highest potential.,https://www.eventbrite.com/e/awakening-yoga-weekly-class-cordoba-tickets-403096501487,sevilla
NA,Sold out,Contact the organizer to request a refund.,"Enjoy a fun exploration game, treasure hunt type, chasing clues, and discovering corners of Estepona with your children. All united by a fantasy tale and a little bit of magic 😉 For children from 5 to 11 years old, with the help and supervision of an adult. Once downloaded you can play as many times as you want, pause it, and resume it, forever 🤩  The route you’re going to follow in the city is sprinkled with unique places, fun clues and challenges, and incredible stories. The experience will play out like you’re the main characters of a movie, only that you’re experiencing everything in first person! Fun dialogue, intrigue, and unexpected interactions are guaranteed. HOW IT WORKS❓ 1. Book your tickets 🎫 2. Download the Questo app - it's free 📲 3. Head to the starting point📍 WHAT YOU’LL DO  The game is an interactive activity where you are guided by a mobile app through the city. With it, you follow directions and solve very fun puzzles, riddles, and cryptic codes. During the game, you will also visit popular and hidden places in the city while learning fun (and we mean it) stories about them. This is a storytelling experience just as much. The people doing these city exploration games gave them an average rating of 4.7/5 around the world. Join the playground too! ------------------ More about Questo 🚶‍♀️ Questo is an urban entertainment platform offering thematic real-world exploration games. It is currently available in over 150 cities 🌎 and has entertained hundreds of thousands of players already. As of today, the app offers more than 400 different experiences created by a growing network of local content creators and event organizers.",7.99,29.99,EUR,Questo - City Exploration Games,https://schema.org/EventScheduled,2024-03-09T17:00:00Z,2024-03-09T18:30:00Z,Streets of Estepona Outdoor Escape Game: The Magic Blocks,"Embark on a thrilling adventure as you follow clues, solve intricate puzzles, and uncover hidden gems in the city.",https://www.eventbrite.com/e/streets-of-estepona-outdoor-escape-game-the-magic-blocks-tickets-706510370537,sevilla
NA,Sold out,Refunds up to 7 days before event,"Synthesis of the human Mind Our internal world drives our external world. Our ability to use our mind determines how well we can control our external realities. What you may not know is that our Minds have an identity. Creating an Identity of mind allows us to direct our external world intentionally. The language we use to run our lives is one dimensional, which creates needless limitations. Our minds work best in a multidimensional language. Learning how to access your minds resources correctly will enable you to create a life beyond who we desire to be. Our vocabulary, are words we use internally to motivate change, but instead of encouraging us, the imperfections in our speech and articulation restrict access to our minds. There is no synchronicity between the one-dimensional language in our speech and the 4 th dimension of the mind. If you’re not using the correct language of the mind, the mind disengages where we become confused. We don’t have the language to describe the life that we want in a way that the mind accepts, understands, and can utilise. Mind ReMapping is a language illuminating an internal identity, so that we no longer need to be afraid of the dark, neither do we need to be afraid of our minds and what the future holds for us. Meta Tech Organica – Excited about Dimensions of LIVING D0 – Orientation – Who you are & who you are NOT. D1 – Point of Focus – What Where When Why & How to SEE. D2 – Objectification – Finding Imagination. D3 – Understanding – 4 Dimensions of Quadrilateral Thinking D4 – TIME – Mind ReMapping.(Cognitive Positioning System) Thank you for your patience. Mind ReMapping N.B. ALL EVENTS ARE ONLINE",14.99,44.99,GBP,Gavin Gooden,https://schema.org/EventScheduled,2024-03-09T19:00:00Z,2024-03-09T20:30:00Z,Mind ReMapping - MINDS LOST WITHOUT IDENTITY  - Marbella - ONLINE,"The MIND ReMapping  Philosophy: ""Be so Creatively removed from reality, that the Mind has no choice, but to come out of hiding….""",https://www.eventbrite.co.uk/e/mind-remapping-minds-lost-without-identity-marbella-online-tickets-645209327467,sevilla
NA,Sold out,Contact the organizer to request a refund.,"Enjoy a funny exploration game, treasure hunt type, chasing clues, and discovering corners of Marbella with your children. All united by a fantasy tale and a little bit of magic 😉For children from 5 to 13 years old, with the help and supervision of an adult Once downloaded you can play as many times as you want, pause it, and resume it, forever 🤩 The route you’re going to follow in the city is sprinkled with unique places, fun clues and challenges, and incredible stories. The experience will play out like you’re the main characters of a movie, only that you’re experiencing everything in first person! Fun dialogue, intrigue, and unexpected interactions are guaranteed. HOW IT WORKS❓ 1. Book your tickets 🎫 2. Download the Questo app - it's free 📲 3. Head to the starting point📍 WHAT YOU’LL DO The game is an interactive activity where you are guided by a mobile app through the city. With it, you follow directions and solve very fun puzzles, riddles, and cryptic codes. During the game, you will also visit popular and hidden places in the city while learning fun (and we mean it) stories about them. This is a storytelling experience just as much. The people doing these city exploration games gave them an average rating of 4.7/5 around the world. Join the playground too! ------------------ More about Questo 🚶‍♀️ Questo is an urban entertainment platform offering thematic real-world exploration games. It is currently available in over 150 cities 🌎 and has entertained hundreds of thousands of players already. As of today, the app offers more than 400 different experiences created by a growing network of local content creators and event organizers.",9.99,39.99,EUR,Questo - City Exploration Games,https://schema.org/EventScheduled,2024-03-09T17:00:00Z,2024-03-09T18:30:00Z,Marbella Outdoor Escape Game: The magic coins,"Embark on a thrilling adventure as you follow clues, solve intricate puzzles, and uncover hidden gems in the city.",https://www.eventbrite.com/e/marbella-outdoor-escape-game-the-magic-coins-tickets-706494352627,sevilla
NA,Sold out,Contact the organizer to request a refund.,"Play a city game and go on an interesting walking tour, where you will follow clues and solve puzzles to discover amazing places and local stories about the great guitarist Paco de Lucía, and his hometown Algeciras. As a player, you will recover the legacy of the “maestro”, while learning interesting anecdotes, not only about him but also about the city. Are you ready to explore? The route you’re going to follow in the city is sprinkled with unique places, fun clues and challenges, and incredible stories. The experience will play out like you’re the main characters of a movie, only that you’re experiencing everything in first person! Fun dialogue, intrigue, and unexpected interactions are guaranteed. HOW IT WORKS❓ 1. Book your tickets 🎫 2. Download the Questo app - it's free 📲 3. Head to the starting point📍 WHAT YOU’LL DO The game is an interactive activity where you are guided by a mobile app through the city. With it, you follow directions and solve very fun puzzles, riddles, and cryptic codes. During the game, you will also visit popular and hidden places in the city while learning fun (and we mean it) stories about them. This is a storytelling experience just as much. The people doing these city exploration games gave them an average rating of 4.7/5 around the world. Join the playground too! ------------------ More about Questo 🚶‍♀️ Questo is an urban entertainment platform offering thematic real-world exploration games. It is currently available in over 150 cities 🌎 and has entertained hundreds of thousands of players already. As of today, the app offers more than 400 different experiences created by a growing network of local content creators and event organizers.",9.99,39.99,EUR,Questo - City Exploration Games,https://schema.org/EventScheduled,2024-03-09T17:00:00Z,2024-03-09T18:30:00Z,Algeciras Outdoor Escape Game: Paco de Lucía's Legacy - A Musical Adventure,"Follow clues, solve puzzles, discover new places and learn incredible stories of the city's past and present during this city adventure.",https://www.eventbrite.com/e/algeciras-outdoor-escape-game-paco-de-lucias-legacy-a-musical-adventure-tickets-654378984157,sevilla
NA,Sold out,Contact the organizer to request a refund.,"Play a city game and go on an interesting walking tour, where you will follow clues and solve puzzles to discover amazing places, curiosities, and stories about Gibraltar. (while following an inner journey that shows what the eyes can’t see). As a player, you will take an engaging exploration of Gibraltar’s town center, while learning intriguing anecdotes, and also some legends. Are you ready to explore? The route you’re going to follow in the city is sprinkled with unique places, fun clues and challenges, and incredible stories. The experience will play out like you’re the main characters of a movie, only that you’re experiencing everything in first person! Fun dialogue, intrigue, and unexpected interactions are guaranteed. HOW IT WORKS❓ 1. Book your tickets 🎫 2. Download the Questo app - it's free 📲 3. Head to the starting point📍 WHAT YOU’LL DO The game is an interactive activity where you are guided by a mobile app through the city. With it, you follow directions and solve very fun puzzles, riddles, and cryptic codes. During the game, you will also visit popular and hidden places in the city while learning fun (and we mean it) stories about them. This is a storytelling experience just as much. The people doing these city exploration games gave them an average rating of 4.7/5 around the world. Join the playground too! ------------------ More about Questo 🚶‍♀️ Questo is an urban entertainment platform offering thematic real-world exploration games. It is currently available in over 150 cities 🌎 and has entertained hundreds of thousands of players already. As of today, the app offers more than 400 different experiences created by a growing network of local content creators and event organizers.",9.99,39.99,EUR,Questo - City Exploration Games,https://schema.org/EventScheduled,2024-03-09T17:00:00Z,2024-03-09T18:30:00Z,Gibraltar Town Center Outdoor Escape Game: A Story Adventure,"Follow clues, solve puzzles, discover new places and learn incredible stories of the city's past and present during this city adventure.",https://www.eventbrite.com/e/gibraltar-town-center-outdoor-escape-game-a-story-adventure-tickets-661583031657,sevilla
NA,Sold out,No Refunds,NA,16.96,16.96,GBP,"CyberActivities, Inc.",https://schema.org/EventScheduled,2024-03-09T10:00:00Z,2024-03-09T18:00:00Z,Scavenger Hunt Gibraltar,A family friendly traditional scavenger hunt with a modern twist!,https://www.eventbrite.com/e/scavenger-hunt-gibraltar-tickets-836448348527,sevilla
NA,Sold out,NA,"Tapas, cocktails and live music!💃 Flamenco Show - Friday🎶 Spanish Guitars - Saturday//¡Tapas, cócteles y entretenimiento en vivo en IXO Tapas & Bar!🍸 IXO Tapas & Bar💃 Espectáculo Flamenco - viernes🎶 Guitarra Española - sábado",0,0,EUR,SO/ Sotogrande Spa & Golf Resort Hotel,https://schema.org/EventScheduled,2024-03-09T19:00:00Z,2024-03-09T21:00:00Z,Live Entertainment at IXO Tapas & Bar,Flamenco & Spanish Guitars,https://www.eventbrite.es/e/entradas-live-entertainment-at-ixo-tapas-bar-816447826427,sevilla
1 hora 30 minutos,Entrada electrónica móvil,NA,"El 9 de marzo no puedes faltar al Concierto Rubén Fernández - Pause&Play C.C.La Cañada (Marbella)📅 Disfruta con tus amigos de una noche inolvidable de risas con el mejor humor en directo 🔥 Recuerda que el aforo es limitado, así que reserva tu mesa para no quedarte sin sitio. Dale al siguiente enlace para reservar tu mesa👇 https://pauseandplay.es/eventos/marbella/la-canada/concierto/ruben-fernandez-2024-03-09/",0,0,EUR,Pause&Play,https://schema.org/EventScheduled,2024-03-09T21:30:00Z,2024-03-09T23:00:00Z,Concierto Rubén Fernández - Pause&Play C.C.La Cañada (Marbella),El 9 de marzo no puedes faltar al Concierto Rubén Fernández - Pause&Play C.C.La Cañada (Marbella),https://www.eventbrite.es/e/entradas-concierto-ruben-fernandez-pauseplay-ccla-canada-marbella-851458775117,sevilla
