Duration,Ticket_Type,Refund_Policy,Description,LowPrice,HighPrice,Currency,Organizer,EventStatus,StartTime,EndTime,Title,Subtitle,url,City
1 hora,Entrada electrónica móvil,Contacta con el organizador para solicitar un reembolso.,"Tras un breve recorrido por el patio y la galería del Museo Pablo Gargallo que nos permitirá conocer la trayectoria y algunas esculturas de este genial artista aragonés, nos adentraremos en la sala “Entre Luces” para profundizar en sus obras de una manera completamente nueva, a través de los sentidos. Mediante diversas dinámicas y juegos, podremos tocar sus esculturas, descubrir con qué materiales trabajó, o cómo fue su proceso creativo. Una visita inclusiva llena de sensaciones, para aprender, divertirse y sensibilizarse. ¿Te la vas a perder? Dirigido a: Público de 0 a 100 años con ganas de divertirse, aprender y tocar las esculturas en el Museo. Duración: 1h -1: 15h min aprox. Precio: 2 € Más información: www.salaentreluces.es MUSEO PABLO GARGALLO AYUNTAMIENTO DE ZARAGOZA Dirección: Pza. de San Felipe, 3 Teléfono: 976 724922 Email: museogargallo@zaragoza.es Horario:",2,2,EUR,Zaragoza Museos,https://schema.org/EventScheduled,2024-03-09T18:00:00Z,2024-03-09T19:00:00Z,"Visita guiada ""Entre Luces"". Público General","Una visita guiada divertida a la Sala Táctil ""Entre Luces"" del Museo Pablo Gargallo donde está ""prohibido no tocar""",https://www.eventbrite.es/e/entradas-visita-guiada-entre-luces-publico-general-849394571027,zaragoza
NA,Sold out,Reembolsos hasta 1 día antes del evento,"¿Qué incluye tu experiencia? ¿Alguna vez has hecho una limpiadora facial con tus propias manos? 🤔 En el taller ""Crea tu propia limpiadora facial ” podrás vivir una experiencia recién sacada de nuestras fábricas Lush. Acompañado por el equipo elaborarás tu propia limpiadora facial, podrás conocer sus beneficios y descubrirás que hacer tu propia limpiadora facial es casi tan divertido como disfrutarla en tu rutina facial 😉 Si buscas el plan perfecto únete a uno de nuestros talleres ¡Conoce tu skincare routine con nuestro equipo! 💕 Hace 25 años inventamos la bomba de baño? Nuestras efervescentes bellezas convierten la hora del baño en una sesión inmersiva de aromaterapia. ¡Y todo lo hacen sin envases!",14.91,14.91,EUR,Lush Zaragoza,https://schema.org/EventScheduled,2024-03-09T17:00:00Z,2024-03-09T18:00:00Z,Planes en Zaragoza: Crea tu propia limpiadora facial.,¿Buscas planes en Zaragoza? ¡Crea tu propia  limpiadora facial natural! Un taller cerca de ti con manualidades para para toda la familia.,https://www.eventbrite.es/e/entradas-planes-en-zaragoza-crea-tu-propia-limpiadora-facial-840723234827,zaragoza
NA,Sold out,No Refunds,"Awaken your mind and body to a new level and learn how to practice meditation in motion. The purpose of this yoga lineage is to guide you toward cultivating a conscious connection, integration and awakening of the body, mind, heart and spirit. You will learn and practice Patanjali's 8 limbs of yoga: Work primarily with the Amrit posture sequence, gentle vinyasa flows and extended posture holding times. Explore the deepest levels of body, mind and spirit with the integrative practices of clear intention, breath, meditative awareness and conscious integration. Learn to balance your nervous system with the “first half” and “second half” of a posture. To transition from an active state of “doing” a posture, to a relaxed state of “being”. And to feel the effects of a posture. Learn to consciously encounter your ""edge"" of body and mind to release deep tensions and restore the natural flow of the vital life force energy (prana). Good for all levels, from those with some experience to more experienced practitioners. Some experience with yoga and postures is recommended. BIOGRAPHY I have been guiding spiritual seekers for over 30 years with the self-transformative teachings of yoga, meditation, Ayurveda and breathing. It is my pleasure and honor to guide you toward self-empowerment, transformation and awakened consciousness. I will help you connect to your deepest self and inner guide, from the physical to the soul dimension. SOULDIMENSION.ORG Copyright © 2022 • Soul Dimension",16.49,16.49,USD,Soul Dimension,https://schema.org/EventScheduled,2024-03-09T16:00:00Z,2024-03-09T17:30:00Z,Awakening Yoga • Weekly Class • Zaragoza,Weekly online class with a spiritual focus to awaken one’s consciousness and highest potential.,https://www.eventbrite.com/e/awakening-yoga-weekly-class-zaragoza-tickets-402642383207,zaragoza
1 día 10 horas,Entrada electrónica móvil,NA,"Como nuestra huella dactilar, la forma en la que deslizamos las letras y las palabras sobre el papel y el modo en el que estampamos nuestra firma es intrínseco a cada persona. Por eso, cuando intentamos imitar una letra o hacerla diferente nos es tan difícil, hay algunos trazos que nos salen naturalmente y que cuesta mucho impostar. La grafología analiza esos trazos naturales y saca conclusiones sobre la personalidad y los comportamientos. Permite determinar las características generales de su carácter, así como el origen de sus emociones, el equilibrio mental y fisiológico, su tipo de inteligencia y las aptitudes profesionales que posee. Pero, ¿qué es Cambia tu letra, Cambia TU VIDA? En este seminario de dos jornadas completas descubrirás, entre otras cosas, el arte de la grafología y cómo a través de ella puedes ""leer"" a cualquier persona. Además, analizaremos tu firma y tu letra en directo. Y te enseñaremos cómo se hace, para que tú también puedas analizarla. Cambia tu letra, cambia tu vida, es resultado de más de diez años de investigación llevados a cabo por el profesor universitario y grafólogo Doctor Joaquim Valls, en colaboración con Manu Ramírez y un grupo de psicólogos, pedagogos y profesores. Dicha investigación dio como resultado la tesis doctoral que avala la Programación NeuroCaligráfica (PNC). Una metodología en la que quedó científicamente demostrada una mejora de un 300% en promedio del nivel de inteligencia emocional de las personas que la siguieron. Numerosos medios de comunicación se han hecho eco de esta innovadora metodología, llegando a tener su propio espacio en el programa de televisión ""Para todos la 2"" de TVE. En este seminario de dos jornadas completas descubrirás, entre otras cosas, el arte de la grafología y cómo a través de ella puedes ""radiografiar"" a cualquier persona. Analizaremos tu firma y tu letra en directo. Te enseñaremos cómo se hace, para que tú también puedas analizarla. Es un evento de dos días en los que: - Descubrirás el arte de la grafología y cómo a través de ella puedes analizar tu personalidad y la de otras personas. - Conocerás la Programación Neurocaligráfica (PNC), una metodología científicamente demostrada para potenciar y desarrollar las áreas más importantes de la inteligencia emocional. - Descubrirás cómo modificando tu letra puedes cambiar aspectos de tu personalidad. - Aprenderás a analizar y rediseñar tu firma en base a la PNC para que puedas potenciar las principales áreas de la Inteligencia Emocional. Si alguna de estas situaciones resuena contigo, estás en el lugar adecuado: En cambio, este evento NO es para ti si:",0,0,EUR,Escuela Superior de Inteligencia Emocional y Coaching,https://schema.org/EventScheduled,2024-03-09T08:30:00Z,2024-03-10T19:00:00Z,"Cambia tu Letra, Cambia TU VIDA - Evento Gratuito -","Si reeducas tu letra,¡reeducas tu inconsciente! No es magia, es ciencia. Y te enseñaremos cómo se hace.",https://www.eventbrite.es/e/entradas-cambia-tu-letra-cambia-tu-vida-evento-gratuito--852391535027,zaragoza
NA,Sold out,NA,"You have a glorious opportunity to get your message into the world. Never before has there been such an exciting time in communication. The ability to transmit your words across the world has existed for decades. What has changed a result of COVID-19 is now people are LISTENING. Virtual communication has now been accepted as the norm. People know that they need to tune into the Facebook Lives and join the Zoom meetings otherwise they are going to be left out of the loop. They are ready to hear your message. Are you ready to give it to them? Your phone and your computer are all you need to make a difference in the world. You have a voice, it’s time to use it. You have a story, it’s time to tell it. You have a message, it’s time to share it. Imagine being able to reach people in places you’ve never heard of and changing the lives of people you have never met. That possibility is more real than ever thanks to virtual speaking. You still aren’t 100% sure about all this, are you? You’ve done some Facebook Lives, you’ve been in some Zoom meetings and you’ve filmed a few selfie videos. You’re trying things out, but you’re not as confident as you’d like to be. It still feels weird not being able to see people. You still feel self conscious seeing yourself on camera. You aren’t getting the likes and comments that you see other people getting on their lives and videos. Does it feel like you’ve been left behind by all this change? You haven’t been left behind yet…but you will if you don’t act now. When the technology arrived to do virtual speaking, only a tiny fraction of people adopted it. During the 2010s they rose to the top of their fields. The “second wave” is now here, and you’ve got to catch it if you want to have a meaningful impact during the 2020s. I joined the second wave late. I started my Youtube channel in 2015, 10 years after Youtube had been created. I first used Zoom in 2018, 5 years after Zoom had been created. I was quicker on the uptake with Facebook Live, being one of the first people in my industry to use it in 2016. I didn’t have the audience nor the engagement of my peers, but I kept learning the craft. When lockdown hit in 2020, I was able to seamlessly transition my business online. I’d been preparing for half a decade to speak virtually whilst the competition got caught with their pants down. I managed to grow my audience and increase my income in 2020 when so many businesses struggled or even sadly closed up shop. There’s one thing that made the difference for me and it will make the difference for you too. I knew how to communicate online. I was far more confident with the tech, more practiced in the communication and more open to the switch to virtual. We still have people who don’t know how to unmute themselves on Zoom. We still have people who speak like an emotionless robot on their Youtube videos. We still have people who think virtual was just a “phase” and not a transition into a new way of doing things. Don’t be one of those people. The second wave of virtual communication is here...are you going to jump on it? This is going to be far bigger than the first wave. If you don’t jump on now, you will get swept away. Equally, if you put in the work now to master virtual speaking, you are going to flourish for the next decade. That is what this Virtual Speaking Masterclass is going to help you do. There are three basic building blocks you need to be a great virtual speaker. Firstly you will learn how to make friends with the camera. Making friends with the camera means that you will: Secondly you will learn why it’s so important to create an “active window”. An active window means that you: Thirdly you will learn how to effectively interact with your audience. Strong interaction means that your audience will: Are you ready for the second wave? Then grab your surfboard and sign up for the masterclass! In the true spirit of Virtual Speaking, we will of course be hosting this class virtually so that you can join us from the comfort of your own home. FAQs Is this definitely an online event? Because the event has a physical location? Yes this is entirely online. The physical location allows people in your city (such as you!) to find the event as it shows up as being geographically close to them. Where can I access the masterclass? You can attend the masterclass live on Zoom. You will be sent the link on the day of the masterclass. The event repeats each month, do I need to attend on a monthly basis? No. The same series is repeated every month. You only need to attend one event.",0,0,GBP,David McCrae,https://schema.org/EventScheduled,2024-03-09T19:00:00Z,2024-03-09T20:30:00Z,Virtual Speaking Masterclass Zaragoza,Online Workshop Teaching You How To Speak Online!,https://www.eventbrite.com/e/virtual-speaking-masterclass-zaragoza-tickets-774543028047,zaragoza
NA,Sold out,NA,NA,0,0,EUR,Centro Cívico Salvador Allende,https://schema.org/EventScheduled,2024-03-09T17:30:00Z,2024-03-09T19:00:00Z,"Teatro ""Pareja Abierta""","Relata en clave de humor negro, la vida de una pareja y el machismo que encierra, incluso en las parejas mas liberales",https://www.eventbrite.com/e/entradas-teatro-pareja-abierta-806296493517,zaragoza
NA,Sold out,Contacta con el organizador para solicitar un reembolso.,"‘CLÀSSICA OBERTA’ A L’ESPAI ORFEÓ, UN NOU CICLE QUE REINVENTA LA CLÀSSICA  Clàssica&Cafè-Concert Gian Carlo Scevola guitarra /Katarina Ruvidić, piano CLÀSSICA OBERTA Serà el primer cicle de clàssica en format cafè concert.  Es tracta d’una aposta innovadora amb servei de bar per fer més atractiva i informal l’experiència d’un concert clàssic. Tots els concerts comptaran amb la conducció del músic i professor Mario Peña y Lillo, qui dinamitzarà els concerts generant diàleg entre musics i públic per a que l’experiència sigui més propera i accessible al gran públic. Les propostes musicals estan pensades per a que qualsevol persona pugui gaudir de l’experiència, apostant per la diversitat d’estils, èpoques i intèrprets.  Una finestra als nous talents CLÀSSICA OBERTA fa una aposta per posar en valor nous talents i intèrprets emergents d’arreu del país, gràcies a la col·laboració de l’Escola Superior de Música de Catalunya(ESMUC) i el suport de la Fundació Horitzons 2050. EL CONCERT D’ARANJUEZ, UN CLÀSSIC UNIVERSAL El Concert d'Aranjuez és una de les obres més emblemàtiques de la música i la guitarra clàssica, i una de les més conegudes pel gran públic. Poca gent sap però, que la seva estrena va  ser a Barcelona, el 1940 al Palau de la Música Catalana.  En el 25è aniversari de la mort de Joaquín Rodrigo, us convidem a escoltar unes de les obres cabdals del repertori per a guitarra i una fita a la història de la música a Catalunya amb el reconegut guitarrista Gian Carlo Scevola, guardonat amb el premi Frèderic Mompou i Miquel Llobet, al Certamen Internacional de Guitarra de Barcelona, acompanyat de la pianista Katarina Ruvidic.",6,8,EUR,Fundació Orfeó Lleidatà,https://schema.org/EventScheduled,2024-03-09T19:00:00Z,2024-03-09T21:00:00Z,Clàssica Oberta/ El concert d'Aranjuez,Clàssica Oberta/ El concert d'Aranjuez,https://www.eventbrite.es/e/entradas-classica-oberta-el-concert-daranjuez-797818636017,zaragoza
1 hora 30 minutos,Entrada electrónica móvil,NA,"El 9 de marzo no puedes faltar al Monólogo Quique Macías- Pause&Play C.C.Camaretas (Soria)📅 Disfruta con tus amigos de una noche inolvidable de risas con el mejor humor en directo 🔥 Recuerda que el aforo es limitado y sólo está permitida la entrada a mayores de 18 años, así que reserva tu mesa para no quedarte sin sitio. Dale al siguiente enlace para reservar tu mesa👇 https://pauseandplay.es/eventos/soria/camaretas/monologo/monologo-de-quique-macias-2024-03-09/",0,0,EUR,Pause&Play,https://schema.org/EventScheduled,2024-03-09T21:30:00Z,2024-03-09T23:00:00Z,Monólogo Quique Macías- Pause&Play C.C.Camaretas (Soria),El 9 de marzo no puedes faltar al Monólogo Quique Macías- Pause&Play C.C.Camaretas (Soria),https://www.eventbrite.es/e/entradas-monologo-quique-macias-pauseplay-cccamaretas-soria-851441403157,zaragoza
